{
  "$schema": "https://json-schema.org/draft/2020-12/schema",
  "$id": "urn:shell-echo:sandbox-runtime:contract:artifact-staging-evidence:v1",
  "title": "Sandbox Runtime Artifact Staging Evidence",
  "type": "object",
  "additionalProperties": false,
  "required": [
    "operation_id",
    "attempt_id",
    "fencing_token",
    "sandbox_id",
    "artifact_reference",
    "status",
    "content_digest",
    "media_type",
    "size_bytes",
    "tenant_binding_check",
    "active_content_check",
    "malware_check",
    "observed_at",
    "expires_at",
    "evidence_digest"
  ],
  "properties": {
    "operation_id": {"$ref": "#/$defs/Identifier"},
    "attempt_id": {"$ref": "#/$defs/Identifier"},
    "fencing_token": {"type": "integer", "minimum": 1},
    "sandbox_id": {"$ref": "#/$defs/Identifier"},
    "artifact_reference": {"type": "string", "pattern": "^artifact-ref:[A-Za-z0-9][A-Za-z0-9._:/-]{0,399}$"},
    "staging_reference": {"type": "string", "pattern": "^ref:[A-Za-z0-9][A-Za-z0-9._:/-]{0,399}$"},
    "status": {"enum": ["staged", "rejected"]},
    "content_digest": {"$ref": "#/$defs/Digest"},
    "media_type": {"type": "string", "minLength": 3, "maxLength": 127, "pattern": "^[a-z0-9][a-z0-9!#$&^_.+-]*/[a-z0-9][a-z0-9!#$&^_.+-]*$"},
    "size_bytes": {"type": "integer", "minimum": 0, "maximum": 67108864},
    "tenant_binding_check": {"$ref": "#/$defs/Check"},
    "active_content_check": {"$ref": "#/$defs/Check"},
    "malware_check": {"$ref": "#/$defs/Check"},
    "observed_at": {"type": "string", "format": "date-time"},
    "expires_at": {"type": "string", "format": "date-time"},
    "evidence_digest": {"$ref": "#/$defs/Digest"}
  },
  "allOf": [
    {
      "if": {"properties": {"status": {"const": "staged"}}},
      "then": {
        "required": ["staging_reference"],
        "properties": {
          "tenant_binding_check": {"properties": {"status": {"const": "passed"}}},
          "active_content_check": {"properties": {"status": {"const": "passed"}}},
          "malware_check": {"properties": {"status": {"const": "passed"}}}
        }
      }
    }
  ],
  "$defs": {
    "Identifier": {"type": "string", "pattern": "^[A-Za-z0-9][A-Za-z0-9._:-]{0,199}$"},
    "Digest": {"type": "string", "pattern": "^sha256:[0-9a-f]{64}$"},
    "Check": {
      "type": "object",
      "additionalProperties": false,
      "required": ["status", "checked_at"],
      "properties": {
        "status": {"enum": ["passed", "failed", "not_run"]},
        "checked_at": {"type": "string", "format": "date-time"},
        "evidence_reference": {"type": "string", "pattern": "^ref:[A-Za-z0-9][A-Za-z0-9._:/-]{0,399}$"}
      }
    }
  }
}
